{
  "sync_id": "HOSTED-PRIVATE-REVIEW-STATE-SYNC-GREEN-RUN-20260521-202417-001",
  "created_at": "2026-05-22T16:32:38.350Z",
  "source_run_id": "GREEN-RUN-20260521-202417",
  "selected_intake_id": "INTAKE-GREEN-RUN-20260521-202417-001",
  "selected_decision_id": "DECISION-GREEN-RUN-20260521-202417-001",
  "active_approval_id": "APPROVAL-GREEN-RUN-20260521-202417-001",
  "package_id": "DRAFT-CAND-PKG-GREEN-RUN-20260521-202417-001",
  "dry_run_id": "PROMO-DRY-RUN-GREEN-RUN-20260521-202417-001",
  "signoff_id": "SIGNOFF-GREEN-RUN-20260521-202417-001",
  "promotion_packet_candidate_id": "PROMO-PACKET-CAND-GREEN-RUN-20260521-202417-001",
  "blocker_resolution_id": "PUB-BLOCKER-RES-GREEN-RUN-20260521-202417-001",
  "sync_status": "hosted_private_sync_readiness_prepared",
  "boundary": {
    "private_runtime_sync_readiness_only": true,
    "not_remote_write": true,
    "not_publication_approval": true,
    "not_real_promotion_packet": true,
    "not_public_preview": true,
    "not_public_record_creation": true
  },
  "flags": {
    "remote_write_allowed": false,
    "public_publish_allowed": false,
    "real_promotion_packet_allowed": false,
    "public_preview_allowed": false,
    "public_record_creation_allowed": false,
    "cron_allowed": false,
    "worker_deploy_allowed": false,
    "raw_text_storage_allowed": false,
    "html_storage_allowed": false
  },
  "hosted_sync_contract": {
    "intended_supabase_table": "atlas_private_review_state_snapshots",
    "intended_worker_routes": [
      "GET /private/review-state/latest",
      "POST /private/review-state/sync-dry-run"
    ],
    "payload_kind": "metadata-only_private_governance_snapshot",
    "payload_version": "1.0.0",
    "dry_run_mode": true,
    "remote_write_attempted": false
  },
  "safety_flags": {
    "no_raw_html": true,
    "no_long_third_party_text": true,
    "no_secrets": true,
    "no_inc_0014_created": true,
    "no_real_promotion_packet": true,
    "no_public_preview": true,
    "no_public_site_mutation": true,
    "no_publication_approval_granted": true,
    "no_remote_write_attempted": true
  }
}
